issue_uid,title_id,issue_vol,issue_no,issue_year,issue_date,issue_pers_name,issue_pers_role,issue_pp,issue_ppc,most_freq_words,key_phrases
bm192009,bm,Vol. 1,No. 6,1920,Sep,F. M. Osbourne,editor,136,20,been (164) eyes (140) face (113) room (106) door (105) hand (90) came (89) other (88) body (84) hankinson (82) johnny (81) time (80) looked (73) made (68) found (67) house (67) light (60) knew (59) young (59) went (58) suggs (58) guerney (58) left (57) turned (57) head (56) jones (54) seemed (53) lake (52) night (52) told (52) side (51) winters (48) first (47) last (46) dead (46) good (46) death (45) took (45) woman (45) heart (44) must (44) moines (43) thing (43) feet (42) inspector (42) voice (42) stood (41) durkee (41) moment (41) place (40),"With the exception of the dust that covered everything, and a dank smell, the room and its furnishings appeared to have been left as they were on the day of the tragedy and Grimstead found himself glancing from time to time at the door of the dressing-room, which was about ten feet from the bed, as if he expected a charming figure in deshabille to come romping into the room at any moment. (790) Johnson, here, who swears that the woman whose body you saw in the morgue, and have identified as your wife, was alive and well at ten o'clock this morning? Yes, he even goes farther and asserts that he talked to her and that she, aided by two others, robbed Harden & Company of a valuable diamond brooch."" Winters leaped to his feet, his eyes blazing, his face aflame with rage. (673) Ten minutes later a figure dressed in Hankinson's clothes, much muffled about the neck and face, and having Hankinson's cap pulled down over its nose, slipped out of that quiet house and went away by devious paths to other and safer parts. (548) Hankinson formed the opinion on good grounds that this young woman retired to bed long before closing hours on Friday nights; at any rate, there was a window in the very upper room in which a light shone for a while every night at half-past nine. (545) Leon has been arrested has confessed! Last night at twelve o'clock the police found Leblanc's mutilated body in a sewer in the Rue de Loix. (511) Winters from its casket? How could she, a dead woman, be alive? And Johnson, as well as other employees of Harden & Company, swore that she had been? They had seen her talked with her nearly twenty-four hours after her reported death. (511) Once more the sound of invisible footsteps and Grimstead looked up from the dead body in time to see the door of the dressing-room open quickly and close. (510) This man stood up as Carney entered, nodded his head slightly and opened a white-washed door a few feet back from where he had been sitting. (502) After finding the body of Jones in the Guerney study, and failing to locate a scrap of evidence that would incriminate the killer of Guerney or of Jones, Johnny had taken Mildred away from the house of death. (495) If the thumb-screws were put on Black Allen he might tell who had hired him, which would save a lot of time and trouble, Johnny had left him in the house because he believed, as the girl had, that the fellow was a detective. (491) Guerney has that in his hand."" ""How is it you didn't hear the shot?"" ""My room is downstairs, and there were several closed doors between."" The lieutenant grunted, and then looked at Jones. (480) A specialist of renown, he had lectured at the medical school from which Doctor Lake had been graduated and, although he did not know him except as a student would be expected to know a class instructor, it made death more of a personal matter and, for a moment, shattered his professional calm. (479)"
bm192011,bm,Vol. 2,No. 2,1920,Nov,F. M. Osbourne,editor,136,20,been (158) door (102) time (89) eyes (89) face (86) came (86) turned (76) made (71) other (71) room (68) night (67) knibbs (67) went (66) bailey (64) song (64) hand (64) knew (64) first (61) thing (61) found (61) black (60) girl (58) woman (58) grimes (54) left (54) body (54) looked (52) head (51) might (50) lewis (49) seemed (48) cardigan (47) took (47) tell (45) last (45) thought (45) bank (45) light (44) floor (44) good (43) felt (42) told (42) asked (41) moment (41) voice (41) heard (41) stood (41) money (41) knife (39) street (39),"The passage was not dark this time, for during the interval that he was on deck a light had been made in the crew's quarters and it sent a pale, trembling shaft through the bulkhead door. (619) He blinked owlishly then sat upright with a jerk, his hand reaching for his gun and then falling at his side at the crisp voice of the detective: ""I've got you covered, Masterman."" The yegg cursed, stared a moment wildly' then his pig eyes snapped evilly as Gunson's other hand, reaching upward behind him, turned up the light. (574) Delaney had given me the approximate angle at which the knife had been driven into the body and this angle corresponded to that which would have obtained had the woman been killed by an arrow shot through the open transom of a room twenty-five feet down the hall. (555) For, following the finding of Backus' body, the board of directors had capitulated despite the protests of Grimes, who suddenly became panic-stricken on Joan's account, as I will explain later, and had hoisted the white flag and, acting under instructions telephoned from what was afterwards discovered to have been a tapped wire near his residence, had left the package of money on a stump close to the tunnel entrance. (538) Too astonished for utterance, Grimes hastened away, laboring under the belief that Joan was, herself, ""The Man in the Black Mask."" She had always been a romantic young woman and the old man feared that she had, at last, given way to her inclination. (494) As he stood there on the deck, swaying with the drunken pitch of the two-masted, square-rigged vessel, it all came back to him came back for the millionth time, with a burning sharpness that made him visualize, as though etched with steel upon his brain, the lamp-lit Australian water-front, the slinking shadows along the quay; made him feel, as if experiencing again, the sickening emotions following the blow and the return to consciousness in the hold of the trading brig bound for eleven degrees south of the equator. (489) Before the vessel reached the white coral walls of Papeite, Black Michael demonstrated that he could keep a threat; The Boy was broken; the slender thread between strength and weakness snapped ... like the string of a fine instrument struck by brutal hands; and when the Libertine cast moorings in the blue lagoon of the Tahitian capital he was still aboard, with a bruised body and a bruised mind, knowing in his tortured heart that some day, when the courage was given him, he would kill the master of the brig. (474) Black Michael's body had been found and the mate had come to accuse him  But how did he find out ? The only incriminating evidence, the knife, had been thrown into the sea. (474) Slipping in quietly by the side door (the room was over a saloon on a quiet street) Gunson, unseen, mounted the narrow stair listened a moment at a door on the second landing turned the knob noiselessly unlocked the door by turning the key from the outside with a long, thin wire made for this purpose  and entered. (462) Hugging the wall, for the more silent footing there afforded, the policeman, one hand before him, feeling along the plaster, the other holding his gun, went upward steadily in the whispering gloom, eyes strained against the blackness, ears attuned to the throbbing silence, like the beating of a heart. (438) You see, young Knibbs, after you left this morning I made a second careful examination of De Brunner's letter from Cassius Wynn and found the envelope not torn open but carefully cut. (436) My brain whirling, I started off in the direction of the house, intending to place my suspicions squarely before Grimes and find out, before going any farther into the case, just what he knew and what he suspected for I was growing of the opinion that he suspected something strongly against, some one when he took sides squarely against his directors, even to the extent of paying all bills himself. (431)"
bm192112,bm,Vol. 4,No. 3,1921,Dec,F. M. Osbourne,editor,132,20,been (263) time (111) found (93) made (90) knew (88) other (86) came (84) room (80) woman (73) house (73) went (62) first (61) thornton (60) door (60) night (57) eyes (56) turned (56) place (54) told (54) money (52) seen (52) asked (52) case (51) seemed (51) meroe (51) good (50) great (49) must (48) jack (47) hand (47) left (46) three (44) cryder (44) find (43) took (43) blind (43) face (42) might (42) head (42) thing (42) years (41) life (40) name (40) being (40) called (39) course (39) tell (39) smith (39) last (38),"Since none of Madame Blavsky's household had seen her from the time dinner was served until her body was found next morning, the police worked on the assumption that it had been she who visited Raine on the night in question. (768) Stifling his natural horror of the deed and abhorrence of the perpetrator of it, the prosecuting attorney had displayed great consideration and humanity in choosing his words and in his manner of speaking when he told Samuel Smith that his crime had been discovered; the body and incriminating evidence found. (718) of November thirteenth,"" the first named being the hour when the deceased was known to have been seen alive the last time, and the latter the time when her dead body was discovered. (712) I had been called into the case on a complaint made by Jedidiah Quinot, of Boston, an esteemed gentleman of his community, who shed real tears, nearly wore out his glasses in polishings and blew his nose prodigiously as he told me the story of his suspicions concerning his harum-scarum nephew one Herbert Cryder, whom he feared had not only hopelessly involved himself but disgraced the family in a gold mine speculation. (696) The defendant, Samuel Smith, was violently jealous of his wife, and on numerous occasions had been heard to threaten to kill each one of several men whom he believed or imagined to have paid too great attention to the said Hattie Smith, described as a beautiful woman by all who knew her. (674) Just as we edged in for the last time I saw something a shadow, it might have been, or a discoloration in the cliff, but at any rate it was something and dropped my glasses to seize my paddle to swing in closer, but before I could dip we were nearly capsized on a hidden rock and only the caution of the Indian, whose muscles had already been set for flight, saved us from death as the vision was snatched from my eyes. (642) Moriarity had been arrested, of course, but released almost at once, because policemen as well as eminently respectable citizens had seen him a block away from the building at the same time that Hardy's scream was heard by the night watchman and elevator man of the building. (639) The prosecuting attorney had been gazing fixedly at this portrait of the murdered woman, with an expression on his face that might have been inspired by a feeling of the stern retributive justice he was called upon to enforce, or, possibly only of sorrow that such awful tragedy should snuff out the life of so charming a woman. (620) More than that, two women, who couldn't tell what had happened to them or the missing men they had accompanied to the House on the Cliff, had been found exhausted and more than half crazy in the big woods that the placp on three sides surround. (617) But the trouble was to find the people who were or had been connected with the ""Aerie."" Stanwood was in charge, but it was easily found out that he spent most of his time in Seattle, Portland, Vancouver or Victoria. (615) During the time that guests were on the cliff, we found that it had been the custom for them to bring their own servants a couple of Japanese boys or a maid sufficing for these visits, which were generally of a sort in which the utmost privacy seemed to be desirable. (613) He came to me rather distressed because yesterday afternoon at five, or a little after, he had been disturbed by the figure of a woman with slightly gray hair and a dark brown dress who stared at him from this room. (606)"
bm192204,bm,Vol. 5,No. 1,1922,Apr,F. M. Osbourne,editor,132,20,been (177) room (109) rita (109) time (106) door (99) made (96) smith (92) letty (92) eyes (80) came (80) farris (77) other (72) nevins (70) head (70) hand (67) went (66) turned (65) face (63) asked (58) left (57) house (57) might (56) girl (56) rudie (53) father (53) floor (53) first (50) knew (50) last (49) garbett (48) pike (47) breen (47) window (46) small (46) must (45) took (45) money (44) open (44) good (44) night (44) looked (44) bradshaw (42) scofield (41) going (40) creighton (40) street (39) detective (39) police (39) held (38) lange (38),"The rooms at the head of the private staircase up which Letty presently climbed were three in number: the first, a sort of anteroom for callers; the second, Lucas Etherton's own room; the third, which opened into the mill, an office wherein Bradwell Pike was usually to be found. (657) Accordingly, when Creighton informed her that on the following Saturday night a batch of new money was to be turned out at Wortz's, Rita at once wrote to Nevins, saying that nine o'clock would be a good time for a raid. (617) Nevins tried to track his wandering girl to her lair, in which fell purpose he had no luck at all till he heard, through police channels, that a Miss Rita Daly had been questioned in connection with the disappearance of one J. (605) ""Open the box for the gentleman, Higgins, like a good boy,"" interposed Smith with what might possibly have been a gleam of hope in his eyes. (536) So it came about that Rita Daly, sitting at an open window in the parlor of Geiger's home at 120 Willow Avenue, was startled to see a good-looking young man whom she recognized at once, walk into the gateway of the Franklin house across the street. (505) It was a desperate attempt and might have ended in disaster had not Langa Doonh bounded through the door at that very moment and struck up the pistol so that the bullet went six inches over Smith's head. (499) Why did not her father speak ? Why did he sit there, evidently jingling the money and keys in his pockets, certainly kicking the waste-paper basket, certainly smiling in that queer, provoking way? This puzzled Letty beyond belief ; it evidently puzzled Sir Cheville too, for after a long pause he turned from the window through which he was affecting to look, picked up the eyeglass which dangled from his neck by a thin gold chain, fixed it in his right eye and stared at the man he was reproaching. (490) As he followed his captive through the door he dropped the gun, which he had been carrying, into his side pocket and turned toward the servants' compartment. (479) For, upon the fire-escape, peering into the room, was Pug! The knife was still embedded in the bootlegger's body; it had not been dislodged from the time Joe had forced the stiletto to its mark. (472) Was his course of action best suited to bring out the man he wanted? Would the head of the organization of thieves attempt a personal blow when so many of his agents continued to fail? Did he lack personal courage or was he, perhaps, known to Smith and feared recognition in the event of a failure to kill? These and similar thoughts occupied the mind of the man upon the carriage seat until he was suddenly interrupted in a most unexpected manner. (468) His eyes searching every corner of the compartment and keenly inspecting the figure of the crying woman, Smith moved on from window to window until he reached the door, which he opened, and stepped inside. (459) He leaned his tall figure towards her, resting his hands on the bars of his bicycle, and Letty noticed for the first time that he had curiously green eyes which scintillated in a strange manner. (456)"
bm192208,bm,Vol. 5,No. 5,1922,Aug,F. M. Osbourne,editor,132,20,been (261) time (109) detective (105) other (104) room (103) went (102) knew (92) made (87) door (87) found (84) office (81) weathershaw (81) hanley (78) first (71) turned (70) came (68) told (66) might (65) dennison (58) going (58) mike (57) heard (56) things (56) woman (54) bruckner (54) took (54) face (54) course (53) thing (53) fact (53) judge (52) night (52) marrows (52) gone (52) good (51) work (50) body (50) years (50) cheever (49) eyes (49) table (49) case (49) seemed (48) asked (47) tell (46) morning (46) murder (46) police (45) looked (45) thought (43),"So, while the prisoner was being arraigned in a police court on a short affidavit, the necessary witnesses were taken before the grand jury, then in session, and Daniel Henderson, indicted for murder in the first degree, was in the Tombs awaiting trial, less than eighteen hours after the body of his victim had been discovered. (713) Perry owned real estate to the value of one hundred and forty thousand dollars on East One Hundred and Fifty-seventh Street and that the property had been purchased at about the same time the doctor opened his dental office. (681) Then, a week later  when Dennison was arrested when she had read that on the kitchen table of his apartment had been found a blueberry pie w'ith a piece cut out of it and the slice missing, she had felt that to her had been given the last link in the chain of evidence. (678) Quizzed about the tragedy, he admits going to the hotel, but says that when he found the door unlocked and entered the room the place was empty, so he figured that the couple had gone to some show, and went outside to wait for them. (676) Where had Detective Carr been before he came to the attorney's office? Before the mystery could be solved that question had to be answered. (658) The cold-blooded fact that just before or after he had killed the woman who had been everything to him for two years he had eaten a piece of pie that she had baked as a surprise for him, turned people against Dennison more than any other one fact of the tragedy. (629) He had seen for some time that his employer had been ill at ease, and he thought that Hanley breathed a sigh of relief when the others were gone. (616) At first Hanley had been aided by two assistants, but in time the business grew so automatic, and so relatively unimportant to its owner, that Morely directed him to do without any clerks. (582) He spent the time running down the history and official record of the Kirven murder case, a crime which had been committed some ten months previously. (571) He had been in his office about an hour when three men, who introduced themselves as Detective Sergeant Elm, Detective Mosher and Medical Examiner Richards called on him. (558) He was watching the detective keenly, and as he watched, he fancied that he saw a certain glance, which might have been a signal, exchanged between him and Marrows. (555) He had not been married and consequently had no direct heirs, but Hanley learned in due time that the estate had been left to a distant cousin. (547)"
bt193501,bed,Vol. 1,No. 10,1935,Jan,Anonymous,editor,52,25,doris (39) eyes (28) george (26) lips (24) nelly (22) hand (19) monsieur (17) been (15) sara (15) head (15) love (12) arms (12) other (11) florette (11) kiss (10) asked (10) marcelle (10) morning (10) laughed (10) room (9) rene (9) night (9) fingers (9) smiled (9) francois (8) hair (8) good (8) skin (8) hands (7) must (7) wilbur (7) might (7) sophie (7) lovely (7) murmured (7) smile (7) face (7) shoulder (7) turned (7) lifted (7) mademoiselle (7) girl (6) mouth (6) pierre (6) door (6) shall (6) life (6) closed (6) brunette (6) margie (6),"""This other hand is cold, too!"" The remark brought a smile to Doris's red lips. (106) ""Kiss me, and teach me  the meaning of your kind of love!"" She nestled in his arms, her head resting upon his shoulder, her eyes closed. (102) Doris closed her eyes and sighed, twisting her bare arms about him in heavenly rapture. (95) Sara had thrown her curly red head back on the pillow, eyes shut tightly, lips thrillingly a-quiver. (93) Sara's lips were perpetually open, whether or not she was talking, laughing or silent, and George was thrilled by her habit of constantly poking a salmon-tinted tongue-tip between the edges of her pearly teeth. (88) A pungent perfume mingled with the crispness of the air as she swayed forward to accept the flame of a match for the cigarette that she placed between her lips and George was agreeably disturbed by the pressure of a warm thigh just above his knee. (80) As she did so, George saw the white surface of a bare back that the decolletage of her gown uncovered to the bend of her hips, and when she swung around to face him he was confronted by a similar expanse of pale skin except for peaked strips of velvet that cupped the softness of her breasts. (79) Her eyes met his for a brief instant, held them, and fell, her lips tightening as the realization came over her that her cheeks flushed crimson. (78) Laughing happily, Doris thought of Nelly and her ministrations that afternoon. (75) ""Who's your girl friend?"" asked another operative after Doris had left the shop on the evening of her first visit. (75) ""I hope so!"" murmured George inanely, dropping his eyes to the swelling mounds so frankly disclosed by the brevity of her corsage. (74) Sleeky tigerish eyes were focused upon George as Sara rambled on. (73)"
dsm19160305,dsm,Vol. 2,No. 5,1916,5-Mar,Frank E. Blackwell,editor,132,10,verbeck (277) been (258) black (208) star (191) muggs (178) time (129) room (120) door (113) other (107) house (83) found (82) street (81) hand (81) made (78) first (74) face (70) eyes (67) might (66) came (64) left (64) went (64) chick (61) police (61) seemed (60) turned (59) head (58) three (57) young (56) knew (56) detective (55) asked (54) told (54) night (51) tell (51) floor (50) brittain (50) good (48) great (48) place (48) table (47) find (46) looked (46) side (45) steene (45) took (44) thing (44) must (44) nick (43) torrey (43) orders (42),"MUGGS stood in front of the door for a moment after Verbeck had dashed from the house, then turned to face the Black Star again. (1285) Muggs hurried across the room to the window to watch, while Verbeck remained gazing through the crack in the door at the Black Star, who sat down in the armchair and began inspecting the letters on the table. (1265) Even in this moment of pain, Muggs, though claiming no superior power of reasoning, could not help but think what a fool the Black Star had been to tell Verbeck his schemes. (1252) Could it be possible, he asked himself, that some of the Black Star's band had grown suspicious, and would take an active part against him? Had the Black Star, a prisoner in the old Verbeck house, sent out some message from his prison calling for rescue? Verbeck was half afraid he had made some blunder, had overlooked something that would allow the master criminal to turn the tables and emerge victor from the duel of wits. (1198) It seemed that the Black Star grew taller and straighter as he looked at the other man, and Verbeck and Muggs could see his eyes glittering through the black mask. (1175) Verbeck had no orders ready for her, for her number had not been on the list he had found in the Black Star's book. (1122) Despite the Black Star's words, Verbeck had been half of a mind that the master crook was some one known to the city in general as a respectable man, a sort of Jekyll and Hyde. (1117) He waited for a time, as the Black Star had done, then opened the door and walked boldly into the room, nodding his head to the other man in robe and mask, and taking his position at the Black Star's blackboard. (1095) EIGHT o'clock that night found Roger Verbeck in the Black Star's headquarters, the room put in order, and the candles burning. (1075) He wanted just one blow at the Black Star before the police arrived, for the blow that had been given him, and for the misery Verbeck had been caused. (1067) The Black Star struck him even as Muggs had struck the Black Star in his headquarters room, when Roger Verbeck was shot into the pit. (1055) There was fuel in the house, and after they had carried the Black Star in and made him comfortable on a couch, Verbeck built a fire in the large grate in the living room. (1036)"
