issue_uid,title_id,issue_vol,issue_no,issue_year,issue_date,issue_pers_name,issue_pers_role,issue_pp,issue_ppc,most_freq_words,key_phrases
lsm19341020,lsm,Vol. CXI,No. 1,1934,20-Oct,Daisy Bacon,editor,164,15,eyes (178) been (151) janine (135) love (118) girl (106) time (104) other (101) tell (89) dawn (87) face (82) young (81) jack (79) came (79) room (78) girls (75) miss (74) voice (69) went (69) night (69) heart (68) years (68) phil (67) first (66) knew (65) made (65) thing (64) thought (64) bill (64) want (63) esther (63) gloria (62) arms (62) head (61) door (61) going (60) duke (60) adela (60) letters (59) find (59) good (59) write (58) jill (58) billie (58) life (55) lutie (54) asked (54) born (54) lips (54),"A tall woman, with fair hair, huge gray eyes, and lips that seemed to Dawn the most beautiful in the world lips that Jack had kissed! ""As though he would ever want to kiss me again after kissing her!"" she thought miserably. (780) But it was a pair of steady gray eyes that measured the distance from rail to cartwheel; a brave heart that shut her mind to the consequences if she failed and opened it deliberately to the situation below, in time to hear Slim rasp out: ""And I tell you, you got just thirty seconds to produce that girl. (760) In quick answer to Phil's gaze, Dawn swung to see the door beside which they sat, open, and through it came a tall woman, with fair, pale hair and huge gray eyes. (707) Big arms swept about her suddenly and firm lips came down upon hers and Barbara knew that never in all her gay, spoilt life had Adela Ash been kissed like that. (618) Adela Ash, heiress to goodness only knew how many millions, and accustomed to the most exclusive hunt parties in America, being likened to a rodeo queen! She had laughed until Bill's brown face had become one enormous blush, and then she had dug her heels into Sorcerer's sides so that he had gone off down the trail like the wild streak of lightning he was, and Bill had been hard put to catch her. (615) ""I won't be afraid of anything as long as I have you."" Janine, looking up into his eyes, shivered with happiness as his arms closed about her and his lips crushed down on hers, hot and fierce, in a kiss which made their very souls one forever. (612) Dear Miss Morris: Is there room in your Corner for a teen-age girl who craves excitement? I'm a freshman in high school, have red hair, blue eyes, and a cheerful disposition. (610) I'm a girl twenty-one years of age, have brown hair and eyes, and some of my friends tell me I look like a famous movie star. (593) In the days that followed, when she dived into the trunk for this possession or that and exposed the lovely things, Lizette only looked knowing, so Janine guessed that her roommate had been through the trunk, but she didn't care. (587) He seemed to have unlimited funds, and Janine grimly pushed the thought of their source into the back of her mind, along with the other self who had once been safe in Beverly. (582) Kill Jack! And, with a frightened sob and a wild, crazy sweep of her arm, Dawn grabbed the first thing her frightened fingers could touch the huge blue bowl, with its heavy freight of flowers and water, and sent it careening madly toward the floor and Poke's feet. (571) Wouldn't Anne laugh to hear Buddy proposing that Janine Broun have a blind date with a gangster named the ""Silver Duke""? Certainly she had hidden Janine well under the ""Jimmy Brown"" that Swantown knew. (548) ""Buddy Draconi asked him to take me for a ride on the water to cool off,"" Janine stammered, because Lizette's eyes looked so knowing. (546) The first time I went out with him was because I was so discouraged about the other boy, but gradually we began going out three and four times a week. (540) Dear Miss Morris: I'm a friendly girl of twenty-one, with dark hair and eyes, fond of dancing, travel, and swimming. (540) For another thing, Lutie knew that her cousin Janine had given Aunt Millie ten years of her life so that Lutie could stay in an expensive French school. (535)"
lsm19350330,lsm,Vol. XIV,No. 6,1935,30-Mar,Daisy Bacon,editor,164,15,eyes (183) girl (179) time (141) love (136) been (124) other (111) young (93) face (91) room (91) miss (88) good (87) melina (82) mother (79) told (78) mabrue (77) girls (76) heart (72) voice (69) years (68) thought (68) night (66) went (65) came (65) life (64) hand (63) write (62) looked (61) letters (61) tell (60) find (60) made (60) door (59) knew (59) bobbie (57) morris (56) husband (56) thing (56) hands (55) lips (55) first (55) diane (53) answer (53) janice (53) arms (53) head (52) born (51) asked (50) norman (50) going (50),"Dear Miss Morris: Does any one want a peppy Pal who will answer all letters promptly, and who has lots of interesting things to talk about? I am a girl of eighteen, with brown hair and blue eyes. (854) Dear Miss Morris: Will you please help me find some Pen Pals? I'm a girl twenty years of age, live in California, and would like to hear from girls far and near. (718) I have no time for girls, no time for anything but my work."" He flashed her a glance, and his eyes told her something that his lips denied, something that made a wild surge of joy beat through her. (701) Dear Miss Morris: May I hope to hear from Pals everywhere? I am a girl of twenty-two, live in Nova Scotia, and love to make friends. (680) Dear Miss Morris: I am a lonely girl of twenty-two, enjoy movies, mystery stories, and love to write long letters. (650) ""Some one rich and important,"" she supplied dryly, and if you hadn't seen the hurt in her dark eyes, you might have thought it didn't matter that the man who had professed his undying love for her not two days ago was now backing out lamely. (650) ""I've never been so darn keen about a girl before,"" he told her with earnestness in his voice and eyes. (645) ""I have, but I've never been so darn keen about a girl before,"" he told her with earnestness in his gay voice and eyes. (645) Dear Miss Morris: I am a lonely girl of twenty-two, five feet two inches tall, have blue eyes, and a jolly disposition. (633) Dear Miss Morris: I'm a Chicago girl of nineteen, love to write letters, and promise prompt replies. (622) A girl would have to have plenty of courage to marry a man who considers existence a giddy round of good times, and who does not realize that life and love have a finer, deeper meaning, far more important than any light-hearted gayeties of the moment. (622) The words came from Honey's opened door, and hearing them, Pitt's voice dribbled off into a half-muttered sneer; swinging to follow his startled eyes, Bobbie found her own angry denial, stilled on, her tongue. (611) Take me away! Please, Pitt, take me away from this awful place! It does things to people-terrible things! Last night I tried to bomb the river bank the way old Tim said up here at the cottage! Bobbie doesn't love you; she told me so. (606) Gelders 54 Orchid Girl Paula Rockwell 64 Heartless Flirt Ives Tudor 78 Violet Eyes Ethel Le Compte 93 Musical Proposal Leslie Gordon Barnard 125 POETRY Winter Sale Bert Coksley 23 Enchanted Garden Franklin Pierce Carrigan 53 Love Elfria Norden 92 Coquette Doris I. (601) The bus stopped in front of the jeweler's shop, and as she gazed down, it seemed to Janice as though she was once again the plainly dressed girl who had found herself suddenly looking into a man's eyes. (586) While he sat there staring discontentedly into space, he heard a girl's voice outside the door and turned his head quickly as it opened, expecting to see Janice, but the girl who stood smiling at him from the threshold was Gina Mornington. (584)"
nlt1940win,nlt,Vol. 1,No. 19,1940,Jan,Anonymous,editor,28,25,eddie (48) salvatia (37) pietro (31) eyes (26) sammy (18) arms (14) crown (13) love (13) lips (12) prince (12) monsieur (11) looked (11) marie (10) gypsy (10) face (10) been (10) bear (10) time (9) black (9) tent (9) came (8) uniform (8) fake (8) dark (8) heart (8) four (7) years (7) girl (7) driver (7) head (7) mouth (7) gone (6) stopped (6) other (6) made (6) went (6) people (6) knew (6) doorman (6) legion (6) wrestle (5) costume (5) vendome (5) moved (5) frenchman (5) short (5) hugo (5) circus (5) rosalie (5) stood (5),"Salvatia said coolly, ""I love you, Pietro."" But her voice lacked warmth; her eyes did not glow as Rosalie Benoit's blue eyes glowed when she looked upon Pietro. (140) Eddie doffed his thinking cap for the time being, stepped into a cafe for an absinthe frappe. It was six-thirty when he returned to the lobby of the Vendome, slumped down in a chair behind a potted palm, kept his eyes glued on the elevators. (120) He moved his palm over her face, feeling her slim straight nose, her lips, the soft line of her chin and looked into Salvatia's wide, burning eyes. (119) But even though Sammy's blue eyes had blazed, even though his breath had gone short in his throat that lovely dance had not made him forget that she was, after all, a gypsy girl and therefore a social caste beneath the other members of the circus. (109) ""Rosalie really loves Pietro even though she is ashamed of loving a gypsy"" And Salvatia knew as Pietro gazed at her that he was mentally comparing her coolness with Rosalie's warm emotions; that he was weighing them both, one against the other, and that he was finding her, Salvatia, lacking. (108) Pietro looked down into her slim, dark face, his black eyes burning over that soft beauty. (106) And then suddenly Salvatia stopped short, her black eyes wide, her mouth apart and her bosom swelling suddenly with an emotion that was strangely akin to love for it was hate. (104) Eddie, using his body as a shield against the doorman, jerked a leather-covered black-jack from his pocket swung it, tapped the unsuspecting Crown Prince on the back of the head. (103) Pietro was saying, softly, in a hurt voice, ""Salvatia does not love me, Rosalie. (94) She had gone to his tent that last night, she had stood there in the semi-darkness with hunger in her black eyes, with love trembling on her full lips. (93) Eddie stripped him of his resplendent uniform, ran the cab to the bank of the Seine, rolled the still unconscious Crown Prince into the grass behind a thick bush. (92) Later, Pietro put Salvatia out of his arms and hurried back to his concession. (90) His Highness is now at zee Vendome Hotel."" There was a strange glint in Eddie's eyes. (90) And there would be such a fire of hatred in her eyes that Pietro, seeing that strange flame, would confuse it with love and would crush her to him. (85) And now Salvatia looked at Sammy Richards who was back after four years. (83) Bold as brass, Eddie walked up to the desk, asked for the Crown Prince. (80)"
rr19330901,ran,Vol. L,No. 1,1933,1-Sep,Fanny Ellsworth,editor,162,20,link (266) been (257) eyes (238) loma (215) time (158) came (147) jerry (137) ranch (128) face (123) went (109) hand (103) first (102) thought (99) horse (98) good (96) turned (95) other (94) brady (91) girl (90) coburn (90) made (85) saddle (85) night (83) house (81) head (76) feet (73) door (73) tell (72) jack (72) looked (70) voice (70) scrap (69) told (67) josh (66) years (66) hastings (66) bridger (65) might (65) molly (64) last (63) left (63) moment (62) dawson (62) sanderson (61) seemed (61) sure (61) hands (60) shot (60) town (59),"""How about that timberland you were thinking of buying the last time you were here?"" Josh Hastings' tone was elaborately careless as he put this question, but his eyes were alert as he studied Kay's expression to try to discover whether or not Scrap Johnson had told her what his errand to town that day had been. (1191) The game went on, and as it progressed Link's eyes grew colder and colder, while his face took on that peculiar hawkish ruthlessness that Loma Carlyle had so often noted. (1089) The Sandersons whirled their horses and rode away, but Link, before he left, looked directly into Loma's wide eyes, bowed, tipped his hat and smiled. (1039) She clutched the thought avidly, hungrily, and her lips parted in strange ecstasy as she looked through wide, glorified eyes across the night to where Link Sanderson lay sleeping. (923) Besides that, I'm convinced they've been lootin' the Bar C 88 ever since Bert Mannering died."" And Link proceeded to tell his father his and Loma's suspicions. (893) JERRY and Slim left the ranch early and had been at work for several hours when Slim came running down to where Jerry stood. (889) been made comfortable and a rider had been dispatched to Cabazon for a doctor, Jerry Stone sat on the porch steps and watched the slim, quick-moving figure of Anne as she went about directing the work of the men. (884) Link's eyes seemed to flame in the darkness, and their contact sent Loma's heart to thudding. (872) On the morning of the second day after Loma's meeting with Link, a rider came cantering up to the place, bearing a message from Judge Reynolds that all the necessary legal papers were drawn up and in readiness for her signature. (871) And when Colinga's reptilian eyes flickered and opened, and he made his first effort towards freedom, Loma saw that her work was good. (869) The girl clutched the sagging wooden frame of the door, her brown eyes wide, and her dark hair in sharp contrast to her face, which showed up without an ounce of color in her startled surprise of the moment. (835) Over him stood the wide-shouldered figure of Link Sanderson, his face a cold, relentless mask, his eyes narrow and gleaming. (831) Perhaps a mile had been covered in this fashion when, out of the timber to the east, a rider came loping; he was heading at such an angle as to cut off Link's progress. (813) Loma roused from her period of thought to find Coburn staring at her fixedly, and there was a leer in his eyes that sent the hot color sweeping up her throat. (802) ""Link, maybe you think I'm crazy, but I thought you should know immediately."" Then she went on to tell of the arrival of Texas Jack at the Bar C 88 and of what she had overheard between him and Deuce Coburn. (787) time, however, he did, for the simple reason that Link Sanderson's body was not where it had been a split-second before. (787)"
rr19430301,ran,Vol. III,No. 3,1943,10-Mar,Fanny Ellsworth,editor,148,15,roane (208) been (186) girl (181) eyes (171) ranch (148) bill (133) gary (130) jean (125) came (120) time (116) horse (112) andy (108) face (99) threllen (96) went (96) temple (95) fran (93) horses (85) night (82) made (82) father (81) other (78) coulter (77) seven (75) house (73) jerry (73) voice (72) wagon (71) told (71) looked (71) canyon (70) linda (70) carvel (69) cross (69) gray (68) hand (67) country (61) dolores (60) last (60) turned (60) sheriff (60) good (59) head (58) knew (58) heard (58) room (57) trail (57) asked (56) left (56),"Roane ate, and told of the deal to buy horses from Fred Temple, omitting, however, any mention that the thousand dollars earnest money had been furnished by Margaret McNab living at the Cross Seven. (941) Fred Temple, whose pale blue eyes had been admiring Jean Carvel's pretty face and slim person, pushed himself into the talk. (885) OLDISH Andy Partle, who was Roane Brandon's partner on a small cattle ranch, was frequently heard to declare that his young partner had been born a few decades too late. (884) Jean Carvel was waiting by the wagon, and Roane pulled up to talk to her, while Andy arranged his mount and pack horse to keep their escort of four men back out of earshot. (883) Roane's black-and-tan hound, which he had left at the Gary ranch when he had taken Dan Carvel there, came from the ranch house to greet his master with his usual single deep bark. (857) Young Tom Gary, for the first time since he had been carried to Jean Carvel's camp, was pronounced out of danger by his uncle. (845) Roane was anticipating that Threllen and Coulter would try their old tactics if they met too strong opposition: Send part of their force back through the gorge to circle along the rims and jump the Gary ranch on a flank. (783) Silently the whole group of Cross Seven riders watched until wagon and horses were out of sight; Lafe Hake with his loose-lipped smile keeping his small eyes fixed on the girl on the blood-bay. (776) As the outfit went on, with the wagon wheels jolting hard over stones, the girl on the black horse looked after the slim graceful figure of Jean Carvel. (759) The features of his down-bent face were concealed by the wide brim of his hat, but Bill caught the trustfulness of the blue eyes and a wistful tremor of the girl's lips as she smiled up at her companion. (756) Drinking his coffee, Roane Brandon looked with appreciative eyes at the girl as she climbed briskly into the wagon. (743) This must be a ranch of one of the Gary families; and if the Garys were as quick to shoot as the Cross Seven riders, it might be a ticklish matter to ride up to the place. (730) The rider's big hand fell to the six-shooter in his holster, but as the ugly snout of the gun came up, Jean Carvel spurred past the wagon to push the blood-bay in between her father and Threllen. (726) ""The Cross Seven is not selling horses, I tell you,"" snapped Temple when Andy Partle brought up the matter for the third time. (714) ROANE found Andy Partle, Clayton Gary and two neighbors firing from behind a wall of stones loop-holed for their rifles and looking down on the high wire fence in the gorge bottom. (705) Since there's no other wagon road to Dawn Canyon he's entitled to travel through our range to the Gary ranch to get back his horses. (704)"
rr19440211,ran,Vol. 117,No. 4,1944,11-Feb,Fanny Ellsworth,editor,132,15,walt (216) been (180) eyes (154) kent (141) time (122) rennevant (118) head (116) came (115) horse (108) made (106) girl (105) face (104) lucy (103) went (103) other (99) turned (99) hand (93) looked (88) tracy (84) knew (80) moment (78) rance (70) good (69) harrell (69) ranch (69) puck (68) house (67) terry (66) lucky (66) julie (65) free (64) took (63) seemed (62) found (61) black (61) ford (61) first (61) door (59) thought (59) heard (59) room (57) ronnie (57) billy (55) last (55) left (55) felt (54) stood (54) carmack (53),"For the past twenty he had been foreman of the Lucky Diamond, but ever since Walt and his mother had come back to the ranch to live after the death of Walt's father, two years before, he had been scared stiff that he was going to be put out to grass and the young heir to the ranch given the job he loved. (855) But Ford Harrell and Walt Carmack, for once seeing eye to eye, had perceived how uncomfortable his continued presence made Lucy McAdams, so when the regular chief clerk of the legislature got sick, they managed to get old Lucky Jim Sanderson and Gene Chipman to pull a few political wires that landed the temporary job for the kid. (831) But now for the first time in all his twenty-five years Walt had seen sudden death come to one who was as young and full of life and laughter as himself, one who had been as close as an own brother. (816) For a moment he stood uncertainly inside the door, his hungry gaze searching for a golden head that always caught and held the light, just as it caught and held his heart! Searching also for the lovely, animated face with gold-lashed blue eyes and long, laughing lips. (790) ""I didn't think those pink letters you've been getting lately were bills for whiskey! I'd have headed it off all right if I hadn't found out how nice she is."" She paused a moment and a smile came into her eyes. (759) Walt unsaddled his sweat-caked and weary horse and turned him in the corral, then went up to the house and pushed open the door of the study. (734) With hands that were quick and steady in spite of the sick, shaky feeling down inside him, Walt tied one end of a lariat securely to his saddle horn, then went over the edge, hand over hand down the rope. (698) During Harrell's absence some of the ranch management had naturally gravitated into Walt Carmack's hands, and it hadn't helped the foreman's temper any, on those Sundays when he came home, to find that things on the ranch rocked along on a pretty even keel without him. (697) Walt wrote them all down in a little black notebook and by the time he turned into his own front yard a little after midnight Friday, he had something over fifty thousand dollars pledged, with the chance of another fifteen or twenty thousand coming from the letters he had written to ranchers who lived too far away to reach in one day's horseback circuit. (692) Why couldn't he have been attracted by some sensible ranch girl instead of that two-faced Docie Mitchell? He still loved her even her silly little footprint in the mud and Puck knew him well enough to be sure he'd never look at another woman. (689) There was surprise in his face for a moment, then as he turned his head toward her, even in the moonlight Lucy could see the terror grow in his eyes. (684) When she inquired further in Cosecha she learned that Walt wasn't in town, and, as far as anyone knew, he hadn't been for a couple of days. (677) Walt Carmack had been gone for three weeks and no one, not even his mother, had heard from his since he'd left. (672) Near the head of this little used trail, Walt retied his horse to one side, out of sight in a clump of trees, and took his stance behind a big rock. (663) It was an uncanny shill with which he'd been born, and there came a time when Kent Bradford would have given the whole world to be without it. (647) The man took the lantern, went over and examined the dead Harper, then shook his head and turned to Kent. (643)"
