issue_uid,title_id,issue_vol,issue_no,issue_year,issue_date,issue_pers_name,issue_pers_role,issue_pp,issue_ppc,most_freq_words,key_phrases
2gw194204,2gw,Vol. 3,No. 2,1942,Apr,Robert O. Erisman,editor,116,10,hallock (335) chalk (143) been (120) eyes (106) time (94) hand (91) face (81) other (80) head (80) girl (79) horse (76) came (65) earp (65) looked (62) feet (62) hands (58) thought (58) turned (57) brace (57) good (57) gallatin (57) door (56) race (55) guns (53) side (53) gant (51) hargish (50) shot (50) trail (49) made (49) hoofs (47) left (46) blackfoot (45) dixon (45) happy (45) gunfighter (45) slim (44) lane (44) first (43) stood (42) town (42) heard (41) saddle (41) went (41) might (41) told (40) rode (39) sheriff (39) honor (38),"Had Chalk Gallatin's backbone stiffened at the time Hallock faced him on the slope, the bad cowboy's death might have been less violent might have been, for Chalk had committed the unpardonable sin, to the primitive mind, especially the elemental primitive mind of a man like Hallock, of manhandling a woman, the woman he loved. (961) Hallock and Brace were five miles out of Pinecreek and had followed the main-traveled trail due north, not certain they were on the right track, although the Reverend Saunders had seen Chalk and Sue depart in that direction, until they encountered the body of Gallatin's horse. (868) Puzzlement found place beside Chalk's cold fear when Hallock's Colts began their incessant pounding which emptied both cylinders what was the man shooting at? He had never been known to waste lead and then the question was answered by the sidewise lunge of the furiously driven Concord. (783) Hallock had left the rein-dangling Happy Hoofs at one side of the road and gone down the embankment, carrying the mangled clay of Chalk Gallatin. (782) On the floor a man moved; accustomed to watching the hands of men, their hands and their eyes, Hallock almost mechanically saw the hand of the man lift and mechanically he shot, wondering as he pressed trigger, if there was an unused cartridge in the gun he pointed. (779) But Hallock had erred somewhat in judging the reason for Coldiron's willingness to talk; in fact, neither the gun-fighter nor Brace had given Chalk Gallatin due credit for the craftiness which existed behind his white mask of a face. (760) Two hours later he brought the surprising information that Chalk Gallatin had accepted the challenge, would, accompanied by Blackfoot Dixon to act second, meet Hallock and Brace in an hour behind the Sundown Stage Company's corrals. (758) The next instant the white face of Gallatin flashed upon Hallock's vision; the puncher was on his knees, eyes fastened upon the point in the brush where he thought Hallock would break through. (737) Well, to make it short an' snappy, that lousy pup, Chalk Gallatin's run off with her! Yep,"" as Sam leaped a foot off the floor and Hallock called on his Maker to damn the soul of Chalk, ""she was buyin' stuff in my place half hour or more ago. (709) ""Yuh, Blackfoot! Yuh aimin' to cheat yuhr pal, Chalk, o' the glory o' salivatin' me? Why don'tcha draw, Injun?"" Hallock's tone should have precipitated action on the quarterbreeds part, but it didn't. (704) Determined to learn the worst at once and, incidentally, any other information the preacher possessed which would aid pursuit, Hallock flung Happy Hoofs reins over her head and approached the door of the parsonage. (696) The expression of his eyes was abysmal; it looked for a moment as if, in spite of the twin barrels, Chalk would draw and extinguish that remaining spark in Hallock. (695) Armed with a dug against the vengeance-thirsting Hallock as well to stab him with a blade of grass! But Chalk's eager, curving fingers never closed on that tantalizing Colt-handle a powerful tug at the back of his shirt collar lifted him from his knees; then he was hurled flat on his back and Hallock dropped astride him, driving the breath from his body and seemingly crushing his ribs. (687) ""Leave it lay, pardner,"" drawled a man's voice near at hand and Hallock looked for the first time into the box, lighted by an oil lamp. (682) The telltale shadow on the shade had warned Gallatin, when informed of it by the author of the close shot, Blackfoot Dixon, that Hallock was getting dangerously well, would soon be his old self and now or never was the time to act. (678) Hallock had withdrawn his feet from the stirups and was drawing up his right leg to clear the pommel when the iron-shod hoofs slipped on the none-too-clean floor   though there were a half dozen brass cuspidors in different parts of the barroom and the paint mare crashed down on her left side, pegging one leg of her rider to the floor and his back against the bar. (673)"
adv191102,adv,Vol. 1,No. 4,1911,Feb,Trumbull White,editor,196,15,been (307) came (223) eyes (190) time (174) other (165) haskell (164) great (151) face (150) made (145) first (135) last (132) hand (132) seemed (117) turned (114) went (113) head (112) must (111) knew (109) night (105) good (101) found (100) door (99) moment (98) left (96) feet (94) side (90) told (89) white (87) captain (86) thought (85) heart (84) words (83) looked (83) being (83) water (83) took (82) young (81) hands (78) heard (78) room (76) might (75) stood (74) three (73) river (72) life (71) voice (70) open (69) light (68) felt (68) arms (66),"And we hear of Caizo the Neapolitan and Tappa Milanese and of Mynheer Joachim, best famed as the Great Almayne  and I have known Meister Eisenkopf, alias Mastro Capoferro of Bologna a valiant! Valiant? They are all valiant as cocks, on their own ground! Ever, when I hear of a new mighty peck-and-spur, I marvel what would happen of the last, could they both meet on the same dunghill! I knew one, especially, of late and, body o' me! were I a youth again with limbs and eyes and blood fit for prowess; were I one of those that are ever readier with proof by stoccado than with word argument, with slap of cloak at the face than with sweep of plumed hat "" He struck Beckett on the shoulder with the mutilated hand, in friendly mockery, to emphasize his words and, at the same time, not to leave the eager boy on the right out of his amenity, gave Wyatt a sly thrust of his wooden leg under the table. (1753) ""Ak, senor,"" he cried at sight of the American, ""buenos dias, buenos diasl I regret not having been at home when you came; my house is yours, pray believe me,"" and he advanced to bow courteously, smiling with his lips but not with his eyes; nor did he offer his hand, for which Haskell thought the better of him. (1478) For the first time in his life there came into this strong man's consciousness a vague, troubling, half-realized sensation of fear he was alone with a person whose like he had never encountered; he knew the terrible strength of that hand which rested lightly on his arm, but there was a subtle impression of moral power, of dominant wili-force, in the other's mere silent presence that cowed Blondie and forced him to stumble along sullenly and without a definite thought of flight or resistance. (1386) At the same moment his eyes roved to the open safe and, catching sight for the first time of the bolts protruding from the edge of the heavy steel door, he realized that last night in the dusk he could not have fully closed it before throwing off the combination. (1303) On seeing him emerge at last from the zone of destruction, I was horror-stricken, for apparently every hair had been burned from his head and face, while shreds of skin hung from his hands and cheeks and brow; the dark portions of his eyes even were white under the influence of the dreadful shock he had undergone. (1292) Twice she clapped her little palms together, and the servant who had admitted him reappeared, took the horses and guide in charge after laying off Haskell's bags, and a sullen old Maya woman, who had been lurking under the arches, led him away to a chamber that opened on the gallery directly at the spot where the unknown knife-wielder must have stood at the time of the delivery of the second blow. (1266) Cries heralded the arrival of the party, and there was a rush from all sides; a wall of gleaming bronze bodies, serried rows of curious dark eyes, formed on either hand in a twinkling and Haskell found himself noting the difference between this reception and that which would have been accorded in the village of American blanket Indians. (1157) ""No, far from it, Don Felipe; but I have lost too much time and I must push on to join young Peters, my assistant."" Haskell's eyes dwelt coldly on the other's face. (1155) As he did so, the door closed again and he found himself face to face and alone with the brother who had been lowered before his very eyes into the Cathedral vault the brother Queen Horatia sought to destroy that Gisdel might reign. (1154) For a single moment, that yet seemed, in its tension, to pass the bounds of time, as Wyatt found himself under the glare  felt rather than seen of those sinister eyes that from the first had struck a chill to his soul, the full realization of his madness swept upon him. (1103) The last driver of the last tram had hinted that it was wise to travel by day only, but now after nightfall of the second day the white man and his Indian guide had ridden up to the gates of the Calderon y Ortegas hacienda, been admitted by a servant who had vanished without a word, and now Haskell was walking up and down the patio in the moonlight, waiting waiting to see if some unknown assassin with the henequen knife would get him before the problematic host arrived, or vice versa. (1072) This meant a little truck about the size of a hand-car, with a canopy over it, drawn by two galloping mules driven by a squat, brawny Maya in cotton shirt and pants, whose stubby, bare great toes turned in; whose skin was the color of an old penny; whose close-cropped wiry hair was crowned with a straw sombrero wound with green and yellow; in whose teeth was clenched a long cruel, plaited whip; at whose side hung one of the long, massive-bladed, bent-tipped henequen knives a formidable figure who was strangely shy and gentle save to the mules and for them he found more curses, threats and poetical phrasings of damnation and opprobrium than Haskell had ever heard before. (1056) The Berkintowitz who had been so silent and retiring till that moment came to life with a great joy on his freckled face. (1038) Haskell knew he was looking for the first time on one of tens of thousands of ruined buildings which dot the country from the Gulf of Mexico to the lakes of Nicaragua, bespeaking the life and death of a wonderful people, older than the Aztecs, even older than the Toltecs, perhaps even more ancient than the Colhuans, and some say that these stone cities, often miles in extent, were teeming with the life of a highly civilized people long before the days of Babylon or the birth of the first Pharaoh. (1007) Drawing from his pocket a little round mirror from a transit, he held it in the palm of his left hand in such a way that it could not be seen from above, and though he appeared to be looking down and paying no attention to what went on over his head, he could see well enough to be in no danger so long as the unknown pursued the tactics of creeping around the galleries and striking when the marked man came within reach below. (1006) A trooper, probably for the first time in the history of the world, was at hand, and he promptly struck Stephen Been with the blunt edge of his sword, and towed him to the large hut, with many intermissions in the slabs thereof, which served as a jail. (1004)"
ams192604,ams,Vol. 1,No. 1,1926,Apr,Hugo Gernsback,editor,100,25,servadac (219) been (193) professor (178) comet (169) earth (149) zoof (149) captain (130) gallia (126) must (94) rosette (91) time (88) lieutenant (83) count (80) made (74) hakkabut (71) might (69) being (63) miles (61) procope (54) course (50) other (49) asked (46) orbit (45) first (44) great (44) seemed (44) orderly (43) isaac (42) shall (40) found (39) money (38) last (36) days (36) continued (36) astronomer (34) replied (34) want (34) surface (33) nina (33) jupiter (32) means (32) cried (32) distance (32) good (31) present (31) collision (30) leagues (30) matter (30) stories (30),"Under these circumstances, was it perfectly certain that no danger could accrue? Was not Gallia, when its pathway led it into such close proximity to this enormous planet, running a risk of being attracted within its influence? Might not that influence be altogether disastrous? The professor, it is true, in his estimate of the duration of his comet's revolution, had represented that he had made all proper allowances for any perturbations that would be caused either by Jupiter, by Saturn, or by Mars; but what if there were any errors in his calculations? what if there should be any elements of disturbance on which he had not reckoned? Speculations of this kind became more and more frequent, and Lieutenant Procope pointed out that the danger incurred might be of a fourfold character: first, that the comet, being irresistibly attracted, might be drawn on to the very surface of the planet, and there annihilated; secondly, that as the result of being brought under that attraction, it might be transformed into a satellite, or even a sub-satellite, of that mighty world; thirdly, that it might be diverted into a new orbit, which would never be coincident with the ecliptic; or lastly, its course might be so retarded that it would only reach the ecliptic too late to permit any junction with the earth. (1567) ""Although the orbit of the earth was unaltered,"" continued the professor, ""the result of the collision was the projection of the comet into a new orbit altogether."" ""And may I ask,"" said Procope, deferentially, ""whether you have got the elements of the fresh orbit?"" ""Yes."" ""Then perhaps you know "" ""I know this, sir, that at 47 minutes, 35.6 seconds after two oclock on the morning of the 1st of January last, Gallia, in passing its ascending node, came in contact with the earth; that on the 10th of January it crossed the orbit of Venus; that it reached its perihelion on the 15th; that it recrossed the orbit of Venus; that on the 1st of February it passed its descending node; on the 13th crossed the orbit of Mars; entered the zone of the telescopic planets on the 10th of March, and, attracting Neriria, carried it off as a satellite."" Servadac interposed: ""We are already acquainted with well nigh all these extraordinary facts; many of them, moreover, we learned from documents which we picked up, and which, although unsigned, we cannot entertain a doubt have originated with you."" Professor Rosette drew himself up proudly and said: ""Of course they originated with me. (1542) ""I thought major, that it was not unlikely you were in ignorance of the fact that both Ceuta and Gibraltar have been traversing the solar regions on the surface of a comet."" The major smiled incredulously; but Servadac, nothing daunted, went on to detail the results of the collision between the comet and the earth, adding that, as there was the almost immediate prospect of another concussion, it had occurred to him that it might be advisable for the whole population of Gallia to unite in taking precautionary measures for the common welfare. (1244) ""And if,"" said the lieutenant, after a moment's pause, and the slightest possible frown at the interruption ""and if the collision should occur at our antipodes, the sudden check to the velocity of the comet would be quite equivalent to a shock in situ; and, another thing, we should run the risk of being suffocated, for all our comet's atmosphere would be assimilated with the terrestrial atmosphere, and we, supposing we were not dashed to atoms, should be left as it were upon the summit of an enormous mountain (for such to all intents and purposes Gallia would be), 450 miles above the level of the surface of the globe, without a particle of air to breathe."" ""But would not our chances of escape be considerably better,"" asked Count Timascheff, ""in the event of either of the comet's poles being the point of contact?"" ""Taking the combined velocity into account,"" answered the lieutenant, ""I confess that I fear the violence of the shock will be too great to permit our destruction to be averted."" A general silence ensued, which was broken by the lieutenant himself. (1221) The hypothesis, to which they had now accustomed themselves for so long, that a new asteroid had been formed by a fracture of the earth's surface, seemed to fall to the ground when they found that Professor Palmyrin Rosette had associated the name of Gallia, not with their present home, but with what he called ""my comet""; and that theory being abandoned, they were driven to make the most improbable speculations to replace it. (1197) Somehow or other the conversation would eventually work its way round to the topic of a future collision between the comet and the earth; and in the same degree as this was a matter of sanguine anticipation to Captain Servadac and his friends, it was a matter of aversion to the astronomical enthusiast, who had no desire to quit his present quarters in a sphere which, being of his own discovery, he could hardly have cared for more if it had been of his own creation. (1196) Had he ascertained the true character of her orbit? had he established any data from which it would be possible to reckon what time must elapse before she would again approach the earth? The only intelligible words which the astronomer had uttered had been, ""My comet!"" To what could the exclamation refer? Was it to be conjectured that a fragment of the earth had been chipped off by the collision of a comet? and if so, was it implied that the name of the comet itself was Gallia, and were they mistaken in sup- posing that such was the name given by the savant to the little world that had been so suddenly launched into space? Again and again they discussed these questions; but no satisfactory answer could be found. (1171) They could not explain it, but here they were once more upon terrestrial soil; in a swoon they had left the earth, and in a similar swoon they had come back! Of the balloon not a vestige remained, and contrary to previous computation, the comet had merely grazed the earth, and was traversing the regions of space, again far away! CHAPTER XIX BACK AGAIN ""IN Algeria, captain?"" ""Yes, Ben Zoof, in Algeria; and not far from Mostaganem."" Such were the first words which, after their return to consciousness, were exchanged between Servadac and his orderly. (1165) ""There is no accounting for the freaks of philosophers, you know,"" said Servadac; ""and have I not told you that this philosopher in particular is one of the most eccentric beings in creation?"" ""Besides,"" added the lieutenant, ""it is exceedingly likely that his observation had been going on for some considerable period before the convulsion happened."" Thus the general conclusion arrived at by the Callian Academy of Science was this: That on the night of the 31st of December, a comet, crossing the ecliptic, had come into collision with the earth, and that the violence of the shock had separated a huge fragment from the globe, which fragment from that date had been traversing the remote inter-planetary regions. (1158) ""If it be correct, I suppose we must conclude that the enormous disc we observed on the night of the catastrophe was the comet itself; and the velocity with which it was traveling must have been so great that it was hardly arrested at all by the attraction of the earth."" ""Plausible enough,"" answered Count Timascheff; ""and it is to this comet that our scientific friend here has given the name Gallia."" It still remained a puzzle to them all why the astronomer should apparently be interested in the comet so much more than in the new little world in which their strange lot was cast. (1157)"
