issue_uid,title_id,issue_vol,issue_no,issue_year,issue_date,issue_pers_name,issue_pers_role,issue_pp,issue_ppc,most_freq_words,key_phrases
scs191905,sau,VOL. VI,No. 4,1919,May,Wyndham Martyn,editor,136,20,girl (157) eyes (144) been (132) face (131) rhoda (120) looked (93) time (92) made (85) must (82) father (81) came (81) went (72) goring (71) going (70) hand (68) room (68) seemed (67) door (67) thought (65) first (65) woman (63) good (63) night (63) told (61) knew (60) collins (59) other (57) send (55) love (53) last (52) waler (52) life (52) hands (51) young (51) turned (51) voice (50) moment (50) heard (50) heart (50) light (48) place (48) asked (47) elsie (46) head (46) cried (46) lips (45) willie (45) thing (45) great (45) took (44),"Then the man turned deliberately, and gave a last long look of implacable hate at the receding station; but the woman's eyes went to his face, and her free hand shot forward with a jerky little movement and took its place beside the other on his arm. (823) ""I'll not run from a cowardly pack of swine,"" cried Waler violently, ""my gun will send a hundred flying; I'll pot them as they come."" He laughed wildly then turned sharply to the girl, ""this is no place for a woman, Rhoda, you must go. (712) She seemed all that was sweet and wonderful in life the rose lights from a sinking sun tinted her thin little face, her hands lying in her lap looked transparent, her fair hair brushed back from her forehead gave her an almost childish look, but Larry did not see the sadness in her eyes. (687) When Rhoda was dressed she glanced into the long mirror and knew that she had never in her life looked more attractive; her face was vivid with color, her blue eyes unnaturally bright. (675) Heckers has quite lost touch with affairs, but there's a Bengalee babu at the bottom of this; there always is when there's any trouble in India."" He paused a moment to run a firm hand over his brown hair; then his quick, decisive voice went on, ""If Waler hadn't been pretty certain of a disturbance here, he'd have been the last man to have wired for help. (674) For a moment Rhoda looked at her breathless, then the full, degrading significance of this woman's presence at her father's side broke upon her this black and shameless creature standing in her dead mother's place. (623) Half a block from his house he saw the light from the front room glowing across the sidewalk, and knew his wife was waiting for him, that little Marie would be expecting some candy, and after giving him a big ""yug"" as she called it, would begin searching his pockets, a game they played when he reached home before she went to bed; which, of late, had not been often, he remembered. (602) At last the train pulled in at Rhoda's station; the little cars jerked to a stop and the girl leaned eagerly out of the window to catch a first glimpse of her father. (599) How dark the shadows were under her blue eyes! For a moment the desire to take her in his arms, to feel again the sweetness of her close against his heart, stirred the man's every sense; but she did not love him she was going to marry Townsend. (581) The ayah squatting at her feet, sensing the girl's thoughts of love, murmured a charm that the eyes of the Captain sahib might be pleased with the work of Hokigan's hands. (571) For a moment despair seized Goring  exhausted and unarmed, he took hold of the side of the drifting boat and looked to where he knew the girl now was safe. (560) James Montgomery Flagg once again takes his brush ""in hand"" to paint the cover for Saucy Stories this month this time he gives us his ideal of Florence Dixon, of whom it is said, ""She is the most photographed girl in America,"" and probably you have by this time met Miss Dixon on the screen, as she was starred in one of the latest James Montgomery Flagg Comedies that Paramount are releasing, titled, ""Independence B'Gosh!"" Remember? She had the part of maid to Sara, wife of Horatio Whiffle and was also sweetheart of Horatio's man, Sam (Olin Howland). (552) Raxter : A life time for hit! Seems like a miracle, you're marrying me, May! You could have picked the best of us, and you took me! I can't figure hit out, unless hit's because I love you with a love that's just reached for you ever since I first set eyes on you five years ago. (547) Rhoda looked off toward the living-room, where, under the shaded light, she could see the boy's mother and father, face to face at the small card-table. (544) The girl beside him tried to follow what was being said: she heard her father's name, but though she could not understand intiutively she knew that whatever word had come was not good. (529) The excitement, the fatigue attendant on her struggle and her fear of this swearing, angry beast almost upon her, made the girl for the first time in her life faint dead away. (528)"
scs19220801,sau,Vol. XIII,No. 2,1922,1-Aug,Wyndham Martyn,editor,132,20,been (136) eyes (131) clayton (112) john (96) door (86) came (85) hand (83) time (79) dora (78) doris (74) archie (70) young (68) trip (68) alice (68) found (68) other (67) looked (66) girl (65) face (65) nita (64) told (64) room (62) thought (61) moment (60) made (60) asked (58) first (58) must (54) harlan (53) might (51) thing (51) head (51) good (51) tell (49) went (48) left (48) knew (48) love (47) house (47) seemed (46) turned (46) course (45) night (45) madge (44) billy (44) took (44) felt (43) moore (43) place (42),"""He looks at me,"" she thought restlessly, ""as though I'd been made to order for him, like Louis makes his Berkshire Salad."" And she would almost have hurled back his bargain into his mean eyes, had she not caught the suspicion of Wally's glance. (546) Clayton told him what had happened that afternoon, including the clue he believed he had found, in the description of the tea which the Girl in Gray had been given. (530) Then Alicia asked the man to get Nick Brewster's pretentious place, nestling under the mountain at the other end of the valley, and in due time Doris Brewster's voice came clearly through the ether. (528) Alice went home to her boarding-house and cried herself to sleep on the bed, but at six o'clock Hal Ross came to take her to dinner and for the first time in her life perhaps she was glad to see a man and showed it. (502) At her door she left him with lowered eyes and only a faint ""Good-by,"" so that he left her house happier than he had ever been in his life. (492) He had slipped, for the time being, from the proper John Harlan Margery knew into the wild Jack Harlan who used to wait at the New Amsterdam stage-door for Peggy. (443) ""Why, has anything been the matter with you, John?"" Margery asked at once, looking into his flushed face closely. (443) When Clayton crossed over to help Moore install their private telephone, he found him waiting at the front door of the house. (441) But Harlan quickly brought it back to normalcy by assuring it that there was no room in his present scheme of things for girls   especially very pretty girls with creamy skin and large blue eyes and golden hair as smooth as velvet, like Margery's. (440) ""If you marry old Anton, you'll be his! You'll belong to him! Do you want his old hands to pet you? He ain't got no right to such a dainty young girl! Wally, now he's clean! He's young! He's full of the devil, p'raps, but his eyes are bright and his mouth ain't so experienced. (440) A great deal relieved, Clayton returned to the front hall, stationed Larry in the alcove there, and made his way to Vining's desk in the front room. (426) Then, just when he faced the darkest hour, when he seemed unable to work or play because of this girl, Sutherland came across Alice's letter, almost two years old now, at the bottom of his trunk. (419) Presently Alice found herself in Maurice's arms, his eyes on her face, his voice low and tense in her ear. (418) ""Didn't what?"" asked Van Horn casually, looking him full in the face with a glint of amusement in his eyes. (418) To the ripple of amusement, Nita's cheeks stained pink and her eyes, which had been appealing, now turned darkly defiant. (404) The door was open into his bedroom beyond and the first thing Clayton noticed was a lot of telephone wire, lying on the floor. (401)"
smart191912,sma,Vol. LX,No. 4,1919,Dec,"George Jean Nathan, H.L. Mencken",editor,152,35,been (220) other (142) time (121) eyes (115) ethyl (108) first (100) andrew (97) young (97) came (86) girl (84) holland (82) knew (81) went (79) made (78) life (77) seemed (76) room (72) woman (72) thought (68) face (68) years (64) door (63) calvert (63) good (63) must (62) bianca (62) love (61) might (60) last (60) wills (59) looked (59) night (58) office (57) moment (56) found (56) things (55) great (53) passed (53) days (52) being (52) turned (51) city (51) women (50) hand (50) took (50) felt (50) mother (48) told (48) mind (47),"Three days later the case went to the jury, following a forceful, logical argument for conviction on the part of the District Attorney, in which he emphasized particularly the sheer impossibility of the crime having been committed by other hands than those of the prisoner. (773) Guardedly it theorized; more boldly it alluded to the obvious necessity of the arrest, recounting the fact that the vietim had been found dead five minutes after the departure of the prisoner and that no one apparently had entered the private office in the interim; but the general tendency of all the newspapers was to ""play up"" the mystery, since the standing of the accused a junior member of the old and distinguished banking house of Gardener Brothers  was so unimpeachable that, in the absence of motive and as yet no motive had been ascertained it was almost inconceivable that he should be guilty. (695) She had been busy down town before marriage, and her mother, who didn't like to cook either, had said ""Ethyl will learn like we all do, when the time comes."" So Ethyl was learning now, using Andrew's money for experiments and the results were not all he hoped for. (669) No longer will the policeman stay me, But the thousand others, From crossing the Avenue; Nor will the porters see only Three bags and a box And hopes of a quarter When I tell them that last night, By the black water, By the dark blue water, Under a tree that bent over us As trees bend over lovers In the meadows of heaven, Your hands learned my face And your mouth my mouth, And afire with a new knowledge Our eyes shone through the darkness Like four stars. (661) And when he had consumed it he perused his experience, turning over again in his mind each detail of the cabs he had seen; and from that his thoughts slipped calmly to the glorious history of China, going back to the indecorous times before calmness came, and beyond those times to the happy days of the earth when the gods and dragons were here and China was young; and lighting his opium pipe and casting his thoughts easily forward he looked to the time when the dragons shall come again. (650) If he had remained single, Andrew thought that he still might have been a part of real city life as he saw it. (648) Close to this young girl in the charmed prison of her arms, a mystical understanding seemed to reveal itself, a law of life about to be fulfilled, that assured him at last a compensation, a weighing in the other side of the scales, earned pleasure for pain. (636) THE GIRL I went to the councillors, and I stood before their great council tables where they pondered their affairs of state, and I told them the magic of play, and the truths of unbelievable things, of the prayers in children's gestures, and the wisdom in old women's eyes. (635) It might have been a frequency of engagements Ethyl had had with other men, ""A boy I went to school with"" or ""Mr. (627) to the electric chair simply because he had been alone in an office with a man who was found dead five minutes later, and with no more impelling motive than his being in love with the man's wife and about to be separated from her. (617) When the news spread through the city that for no apparent reason the son of Valdivieso had insulted both the daughter and wife of Perez in public, and that young Valdivieso had been taken off to jail, there was quite naturally an intense interest on the part of everybody, an eager expectancy. (615) Sitting near his window, looking out at the street, he thought of the calm hours of only a few weeks past, when the uncertainty of his future had seemingly departed, when, for the first time, life, his opponent, appeared to throw down its plainly read cards upon the table. (606) Hadn't he suspected, from the first? Only today, at noon, he had told himself that Ethyl had been born in New York, that she must be bad. (606) So, at the Rayolds' party, when, after fifteen minutes, we were well beyond the first stages of getting acquainted, and I could see the weeks stretch out, our weeks, it came to me that I was dead had been for a long time. (602) Such a marriage! Yet hadn't he married a city woman? Well now he knew the worst this was the way out and now Andrew knew that it was the way out he had been looking for all along. (597) So, when Lilligore offered to prove, if given the chance, that even more mysterious crimes though less serious had been committed in the Holland, Delray &amp; Dallas offices since the murder, he took the view that such evidence would in all likelihood be all that was necessary to throw the balance to the side of acquittal. (588)"
wt19360809,wei,Vol. 28,No. 2,1936,Aug-Sep,Farnsworth Wright,editor,136,25,eyes (180) ennis (146) door (132) face (128) campbell (125) been (110) hand (102) room (87) came (86) looked (82) dale (80) black (79) hands (77) voice (76) head (73) keane (72) other (71) turned (70) dark (68) dead (66) gunnar (65) made (65) thing (64) woman (63) stood (62) suzanne (62) seemed (61) went (61) body (59) cranston (59) eric (57) merle (56) inspector (55) feet (55) time (54) found (54) first (54) night (53) john (53) valeria (53) last (52) light (52) people (51) great (51) lips (51) shabur (49) felt (49) three (49) must (48) white (47),"With almost blinded eyes, Dale saw Gunnar drop at Merle's feet, saw in his stead a wolf-shape crouching, saw her stoop to it, kneel, kiss the great beast between the eyes, heard her clear, steady voice repeat the words of power, saw the flames sink and leap again. (704) Ennis' eyes fastened on a small, slender girl widi chestnut hair who walked at the end of the line, a girl in a straight tan dress, whose face was white, stiff, like those of the others. (697) He rolled over, dashed the young American to the floor, and leaped up, his dark face and great black eyes blazing. (646) The old man was hatless, and his long white hair lent his face an air of benevolence, but nothing concealed the aura of diabolic evil about him the crimson scar edged in blue and gray, the twisted mouth, the fierce, black eyes, loathsome and gloating. (626) He had risen to his feet, a tall, blond young American whose good-looking face was drawn and worn by inward agony, whose crisp yellow hair was brushed back from his forehead in disorder, and whose blue eyes were haunted with an anguished dread. (605) To Eric she turned a look that was an open caress, leaning toward him, putting a hand on his arm, as he stood beside his chair, stern-lipped, with eyes that would not look at John's hurt bewilderment. (593) Hastily Ennis jerked the gray robe and hood from Chandra Dass' dead body and donned it, while Campbell struggled into one of the others. (577) Ennis saw that the inspector's sagging face was expressionless, and knew that behind that colorless mask, Campbell's brain was racing in an attempt to find a method of escape. (569) Clinging to the girl, Ennis fought like a madman through a darkness in which none could distinguish friend or foe, toward the door at the side from whidi Campbell had fired. (554) AT TWO in the morning, two hours and a half after the odd seizure of Mathew Weems, and while Gest and Kroner and Chichester were in Doctor Grays' suite anxiously looking at the stricken man, eight people were in the sleek, small roulette room of the Blue Bay Hotel on the fourteenth floor. (553) Ennis' dazed eyes lifted from the blazing badge to the Hindoo's dark face. (552) ""What do they do with them?"" Inspector campbell's bright brown eyes showed a hint of hooded horror, yet he shook his head. (536) A long face with pointed black beard, proud curving nose, and eyes dark and secret as forest pools gleamed beneath the hood. (528) Ennis saw Campbell's gray figure slipping round to the side door. (522) Campbell and Ennis reached the end in time to see a long, powerful, gray motor-boat dash out into the black obscurity of the river, and roar eastward with gathering speed. (517) ""She is obstinate, as all women are obstinate."" The sheykh's lean hands were hidden by flowing sleeves, to Dale's disgust; but a muscle twitched above the high cheek-bone, and the dark fire of his eyes glowed red. (514)"
wt193610,wei,Vol. 28,No. 3,1936,Oct,Farnsworth Wright,editor,136,25,eyes (190) been (154) cliff (101) door (96) face (96) father (94) must (90) head (88) came (88) time (84) body (81) other (80) great (79) conan (77) knew (75) stood (75) voice (74) wrexler (74) first (74) hand (71) looked (68) life (67) went (66) black (66) lips (66) last (66) room (60) seemed (60) years (59) turned (57) mind (56) weird (56) light (55) hands (54) held (54) olmec (53) words (53) made (52) vilma (52) duryea (51) sound (50) peter (50) thag (49) horror (49) arthur (49) blood (49) valeria (48) stone (48) smith (48) corio (48),"It may have been the dusk of night, the flickering of the lamps, but Arthur Duryea had certainly noticed how his father's eyes had sunken further into his head, and how his cheeks were tighter, and the outline of his teeth pressed into the skin about his lips. (801) Conan glanced back as he went out the door, at that shambles where the dead lay on the smoldering floor, blood-stained dark limbs knotted in attitudes of fierce muscular effort, dark faces frozen in masks of hate, glassy eyes glaring up at the green fire-jewels which bathed the ghastly scene in a dusky emerald witch-light. (769) I went over in my mind the tales de Lacy had told me of the havoc she had caused; how one man had cast himself down from the highest turret, crying her name; how another had been found dead in the rose garden, horror frozen on his face. (705) John Illustrating a scene in ""Isle of the Undead"" Isle of the Undead Lloyd Arthur Eshbach 259 An uncanny tale of the fate that befell a yachting party on the awful island of living dead men The Lost Temples of Xantoos Howell Calhoun 276 Verse The Opener of the Way Robert Bloch 277 A tremendous tale of dread doom in a forgotten tomb beneath the desert sands of Egypt Witch-Burning Mary Elizabeth Counselman 288 Verse The Lost Door Dorothy Quick 289 An alluring but deadly horror out of past centuries menaced the life of a young American Doom of the House Duryea Earl Peirce, Jr. (685) Wrexler turned to me, ""It would be the curse that has always been upon me that when I fell in love it would be with a ghost!"" His eyes were vivid, shining brightly in his pale face. (677) Now, as though at a silent command, a girl left the group and began to mount the stairs, as those motionless three must have mounted! Vivacious Ann she had been the life of Cliff's yacht party; but now she was changed. (637) The night before we landed, we were standing on deck, at the rail, looking over the side straining our eyes for the first glimpse of the lights of Cherbourg, and Wrexler spoke of himself for the first time since we had left New York. (631) For the translucence of his skin made the thick, black hair that lay close to his head all the darker, while at the same time it brought out the deep black of his eyes, and the firm cut of his lips. (630) So when the warped space-curve ceased to be, and Thag's hold upon reality failed, he must have been dropped back out of the dissolving folds upon the spot where the Tree had stood in the space-circled world, through that vanished world-floor into the spot he had been snatched from in the instant of the dim land's dissolution. (620) In that incredible embrace she stood immobile for a long moment, the Tree arching down with all its curling limbs, the girl straining upward, her head thrown back and the mantle of her hair swinging free of her body as she lifted her face to the quivering blossoms. (618) Because as he died he gazed at last into the living stone face of Anubis the living stone face that held his father's tortured eyes. (614) Why he asked himself in a determined groping after steadiness should the mere sight of a tree, even so fabulous a one as this, rouse that insane panic in the gazer? What peril could dwell invisibly in a tree so frightful that the living horror of it could drive a man mad with the very fact of its unseen presence? He clenched his teeth hard and stared resolutely at that terrible beauty in the clearing, fighting down the sick panic that rose in his throat as his eyes forced themselves to dwell upon the Tree. (612) Now as von Hartmann, overwhelmed by the many strange things which had occurred to him that day, passed his hand over his forehead and cast his eyes downward, he chanced to catch the reflection of his own face in a pool which the rain had left upon the road. (591) Vilma, with black hair hanging stringily about her head, face pale, eyes fixed in the wideness of fear . (587) Men of ancient Persia, clad in leather kirtles and rusted armor, and they were hideous! In the yellow moon-glow Cliff could see them clearly now a lookout standing motionless in the stem, the steersman on the poop-deck, the drummer squatting beside the broken mast, the rowers in the pit and all, all were a bloodless white, the skin of their faces puffed and bloated and horribly wrinkled, like flesh that had been under water a long time. (581) ARTHUR DURYEA, a young, handsome man, came to meet his father for the first time in twenty years. (565)"
